{
  "$schema": "https://json-schema.org/draft/2020-12/schema",
  "$id": "https://changesaga.dev/schema/v5/persona-revision.schema.json",
  "title": "App Saga complete persona revision",
  "type": "object",
  "additionalProperties": false,
  "required": [
    "$schema",
    "version",
    "id",
    "persona",
    "parents",
    "name",
    "description",
    "created_at"
  ],
  "properties": {
    "$schema": {
      "const": "https://changesaga.dev/schema/v5/persona-revision.schema.json"
    },
    "version": {
      "const": 5
    },
    "id": {
      "$ref": "#/$defs/id"
    },
    "persona": {
      "$ref": "#/$defs/record_urn"
    },
    "parents": {
      "type": "array",
      "maxItems": 10000,
      "uniqueItems": true,
      "items": {
        "$ref": "#/$defs/revision_urn"
      }
    },
    "name": {
      "type": "string",
      "minLength": 1
    },
    "description": {
      "type": "string",
      "minLength": 1
    },
    "created_at": {
      "type": "string",
      "format": "date-time"
    },
    "request_id": {
      "$ref": "#/$defs/id"
    }
  },
  "$defs": {
    "id": {
      "type": "string",
      "pattern": "^[A-Za-z0-9][A-Za-z0-9._-]{0,127}$"
    },
    "record_urn": {
      "type": "string",
      "pattern": "^urn:change-saga:[A-Za-z0-9][A-Za-z0-9._-]{0,127}:persona:[A-Za-z0-9][A-Za-z0-9._-]{0,127}$"
    },
    "revision_urn": {
      "type": "string",
      "pattern": "^urn:change-saga:[A-Za-z0-9][A-Za-z0-9._-]{0,127}:persona:[A-Za-z0-9][A-Za-z0-9._-]{0,127}:revision:[A-Za-z0-9][A-Za-z0-9._-]{0,127}$"
    }
  }
}
